{"schema_version":"p0-1.auth-evidence.v1","request":{"request_id":"req_auth004","method":"GET","resource":"/api/v1/tenants/tenant-b/office","action":"read","timestamp":"2026-01-01T00:00:00Z"},"identity":{"subject_id":"user.001","display_name":"Verified User"},"session":{"session_id":"sess.004","status":"VALID","issued_at":"2025-12-31T23:00:00Z","expires_at":"2026-01-01T01:00:00Z"},"context":{"tenant_id":"tenant.a","workspace_id":"workspace.a"},"authorization":{"decision":"DENY","decision_id":"dec.004","roles":["operator"],"permissions":["office:read"],"policy_version":"p0-1.policy.v1"},"audit":{"event_id":"evt.004","event_type":"TENANT_ISOLATION","actor_subject_id":"user.001","outcome":"DENIED","timestamp":"2026-01-01T00:00:00Z"},"evidence":{"evidence_id":"ev.004","type":"REQUEST_TRACE","source":"afagh-runtime/p0-1","integrity":"VERIFIED","created_at":"2026-01-01T00:00:00Z"}}