{"schema_version":"p0-1.auth-evidence.v1","request":{"request_id":"req_auth005","method":"GET","resource":"/api/v1/office","action":"read","timestamp":"2026-01-01T00:00:00Z"},"identity":{"subject_id":"user.001","display_name":"Verified User"},"session":{"session_id":"sess.005","status":"VALID","issued_at":"2025-12-31T23:00:00Z","expires_at":"2026-01-01T01:00:00Z"},"context":{"tenant_id":"tenant.a","workspace_id":"workspace.a"},"authorization":{"decision":"ALLOW","decision_id":"dec.005","roles":["operator"],"permissions":["office:read"],"policy_version":"p0-1.policy.v1"},"audit":{"event_id":"evt.005","event_type":"AUTHORIZATION_DECISION","actor_subject_id":"user.001","outcome":"SUCCESS","timestamp":"2026-01-01T00:00:00Z"},"evidence":{"evidence_id":"ev.005","type":"AUTH_DECISION","source":"afagh-runtime/p0-1","integrity":"UNVERIFIED","created_at":"2026-01-01T00:00:00Z"}}