{"schema_version":"p0-1.auth-evidence.v1","request":{"request_id":"req_auth003","method":"POST","resource":"/api/v1/office/admin","action":"admin","timestamp":"2026-01-01T00:00:00Z"},"identity":{"subject_id":"user.001","display_name":"Verified User"},"session":{"session_id":"sess.003","status":"VALID","issued_at":"2025-12-31T23:00:00Z","expires_at":"2026-01-01T01:00:00Z"},"context":{"tenant_id":"tenant.a","workspace_id":"workspace.a"},"authorization":{"decision":"DENY","decision_id":"dec.003","roles":["operator"],"permissions":["office:read","office:write"],"policy_version":"p0-1.policy.v1"},"audit":{"event_id":"evt.003","event_type":"AUTHORIZATION_DECISION","actor_subject_id":"user.001","outcome":"DENIED","timestamp":"2026-01-01T00:00:00Z"},"evidence":{"evidence_id":"ev.003","type":"AUTH_DECISION","source":"afagh-runtime/p0-1","integrity":"VERIFIED","created_at":"2026-01-01T00:00:00Z"}}